STT,Mã BC,Name,Tỉnh,Quận/Huyện/TP/Thị xã,Địa chỉ,Longitude,Latitude,Note
771,214B01,(LCI) Bảo Thắng,Lào Cai,Huyện Bảo Thắng,"Số nhà 20 đường cách mạng tháng 8, Thôn Phú Thành 3, Thị trấn Phố Lu, Huyện Bảo Thắng, Lào Cai",104.182806,22.323389,Cũ
772,228C01,(NĐH) Nam Trực,Nam Định,Huyện Nam Trực,"229 Quán Chiền, Xã Nam Dương, huyện Nam Trực, Nam Định",106.17403,20.32392,Cũ
773,232D01,(QBH)Trung Trạch,Quảng Bình,Huyện Bố Trạch,"xã Trung Trach, huyện Bố Trạch, tỉnh Quảng Bình",106.53759,17.577756,Cũ
774,271A01,(BPC)Đồng Xoài,Bình Phước,Thành phố Đồng Xoài,"Đường Lê Lai, Phường Tân Đồng, Thành phố Đồng Xoài, Bình Phước",106.90375,11.54347,Cũ
775,236A02,(ĐNG)Nguyễn Hữu Thọ,Đà Nẵng,Quận Hải Châu,"52 Duy Tân, Phường Hòa Thuận Đông, Quận Hải Châu, Đà Nẵng",108.21716,16.04925594,Cũ
776,236H01,(ĐNG) Hòa Khánh,Đà Nẵng,Quận Liên Chiểu,"789 Nguyễn Lương Bằng, Phường Hòa Hiệp Nam, Quận Liên Chiểu, Đà Nẵng",108.1340274,16.10266844,Cũ
777,296I01,(AGG) Thoại Sơn,An Giang,Huyện Thoại Sơn,"Thửa số 83-93, Thị Trấn Núi Sập, Huyện Thoại Sơn, An Giang",105.270084,10.267691,Cũ
778,296G01,(AGG) Phú Tân,An Giang,Huyện Phú Tân(AG),"89 Tôn Đức Thắng, Thị trấn Phú Mỹ, Huyện Phú Tân, An Giang",105.354263,10.590713,Cũ
779,028L06,(HCM) Song Hành,Hồ Chí Minh,Quận 12,"324 Đông Hưng Thuận 02, phường Đông Hưng Thuận, Quận 12, TP HCM.",106.627987,10.842526,Cũ
780,028L01,(HCM) 505 Nguyễn Ảnh Thủ,Hồ Chí Minh,Quận 12,"173A đường HT06, Khu phố 3, phường Hiệp Thành, Quận 12, Thành phố Hồ Chí Minh",106.6862991,10.7538283,Cũ
781,028K08,(HCM) Hồng Bàng,Hồ Chí Minh,Quận 11,"668 Hồng Bàng, Phường 16,  Quận 11, TpHCM",106.643487,10.754432,Cũ
782,028J06,(HCM) Nguyễn Duy Dương,Hồ Chí Minh,Quận 10,"229 Nguyễn Duy Dương, Phường 4, Quận 10, Tp. HCM",106.670358,10.763312,Cũ
783,028W03,(HCM) Long Thới,Hồ Chí Minh,Huyện Nhà Bè,"58/1 Nguyễn Văn Tạo, Xã Long Thới, Huyện Nhà Bè, TpHCM",106.72445,10.666829,Cũ
784,272J01,(LAN) Tân Hưng,Long An,Huyện Tân Hưng,"Đường 3/2, Kp. Gò Thuyền, Thị Trấn Tân Hưng, Huyện Tân Hưng, Long An",105.668437,10.830919,Cũ
785,272D01,(LAN) Châu Thành,Long An,Huyện Châu Thành(LA),"Xã Hiệp Thạnh, H. Châu Thành, T, Long An",106.453239,10.4592351,Cũ
786,205B01,(TPL) Thất Khê,Lạng Sơn,Huyện Tràng Định,"Nà Nghiều, Xã Đại Đồng, Huyện Tràng Định, Lạng Sơn",106.4693318,22.2606407,Cũ
787,277D01,(ĐTP)Hồng Ngự,Đồng Tháp,Thành Phố Hồng Ngự,"Đường Nguyễn Văn Phấn, khóm Mương Nhà Máy, Phường An Thạnh, Thành Phố Hồng Ngự, ĐồngTháp",105.3446043,10.8151782,Cũ
788,238W01,(NAA) Nghĩa Đàn,Nghệ An,Huyện Nghĩa Đàn,"Số nhà 41, Đường 1/5 Khối Tân Tiến, Thị trấn Nghĩa Đàn, Huyện Nghĩa Đàn, Nghệ An",105.486144,19.330899,Cũ
789,272M01,(LAN) Thạnh Hóa,Long An,Huyện Thạnh Hóa,"8 Lê Duẫn, Khu phố 3, Thị trấn Thạnh Hóa, Huyện Thạnh Hóa, Long An",106.1880538,10.6548917,Cũ
790,238E01,(NAA)Quỳnh Thiện,Nghệ An,Thị xã Hoàng Mai,"Khối 6, Phường Quỳnh Thiện, Thị xã Hoàng Mai, Nghệ An",105.718,19.270055,Cũ
791,260D01,(KTN) Sa Thầy,Kon Tum,Huyện Sa Thầy,"193 trần hưng đạo, thôn 2, Thị trấn Sa Thầy, Huyện Sa Thầy, Kon Tum",107.79606,14.410241,Cũ
792,237Q02,(THA) Quảng Xương 2,Thanh Hóa,Huyện Quảng Xương,"SN 96 Thôn Hiền Đông, Xã Quảng Lưu, Huyện Quảng Xương, Thanh Hóa",105.826719,19.680433,Cũ
793,237S01,(THA) Quan Sơn,Thanh Hóa,Huyện Quan Sơn,"khu 4, Thị trấn Sơn Lư, Huyện Quan Sơn, Thanh Hóa",104.945556,20.261389,Cũ
794,237W01,(THA) Như Thanh,Thanh Hóa,Huyện Như Thanh,"Số 292 khu phố 2, thị trấn Bến Sung, huyện Như Thanh, tỉnh Thanh Hóa",105.582222,19.632444,Cũ
795,262E01,(ĐLK) EA Kar,Đắk Lắk,Huyện Ea Kar,"QL 26 Thôn 5 Xã Ea Đar, Huyện Ea Kar, Đắk Lắk",108.462363,12.812133,Cũ
796,262E02,(ĐLK) Cư Huê,Đắk Lắk,Huyện Ea Kar,"Thôn đoàn kết, Xã Ea Kmút, Huyện Ea Kar, Đắk Lắk",108.430492,12.805735,Cũ
797,226F02,(HNM) Thanh Phong,Hà Nam,Huyện Thanh Liêm,"Thôn Phố Bói, xã Thanh Phong, huyện Thanh Liêm, tỉnh Hà Nam",105.918289,20.466246,Cũ
798,205I01,(TPL) Đồng Mỏ,Lạng Sơn,Huyện Chi Lăng,"82 Đại Huề, Khu Ga Bắc , Thị trấn Đồng Mỏ, Huyện Chi Lăng, Lạng Sơn",106.5805256,21.6544119,Cũ
799,205A01,(TPL) Chi Lăng,Lạng Sơn,Thành phố Lạng Sơn,"181B Lê Hồng Phong, Phường Tam Thanh, Thành phố Lạng Sơn, Lạng Sơn",106.7547254,21.8528172,Cũ
800,259C01,(NTN) Khánh Hải,Ninh Thuận,Huyện Ninh Hải,180 - Yên Ninh - Khu phố Khánh Hiệp - thị trấn Khánh Hải - huyện Ninh Hải - tỉnh Ninh Thuận,109.033002,11.588873,Cũ
801,221I03,(HYN) Nghĩa Trụ,Hưng Yên,Huyện Văn Giang,"Xóm 11, Xã Nghĩa Trụ, Huyện Văn Giang, Hưng Yên",105.9991,20.94589,Cũ
802,221D03,(HYN) Lạc Đạo,Hưng Yên,Huyện Văn Lâm,"Xã Lạc Đạo, Huyện Văn Lâm, Tỉnh Hưng Yên",106.02285,20.985115,Cũ
803,238K03,(NAA) Nghi Ân,Nghệ An,Thành phố Vinh,"Gần bến xe phía đông và doanh trại quân đội, Xã Nghi Ân, Thành phố Vinh, Nghệ An",105.6766698,18.7249944,Cũ
804,214H01,(LCI) Văn Bàn,Lào Cai,Huyện Văn Bàn,"189 Đường Quang Trung, thị trấn Khánh Yên, huyện Văn Bàn, tỉnh Lào Cai",104.252611,22.089806,Cũ
300,024K02,(HNI)Quang Trung,Hà Nội,Quận Hà Đông,"Số 73 ngõ 4 đường Văn Phú, phường Phú La, quận Hà Đông, thành phố Hà Nội",105.766361,20.962889,Cũ
806,238N02,(NAA) Tân Kỳ 2,Nghệ An,Huyện Tân Kỳ,"Xã Nghĩa Thái, huyện Tân Kỳ, tỉnh Nghệ An",105.3043176,19.1635638,Cũ
807,213E01,(LCU) Sìn Hồ,Lai Châu,Huyện Sìn Hồ,"SN 05, Đường Trần Hưng Đạo, Khu 3 - TT. Sìn Hồ, huyện Sìn Hồ, Lai Châu",103.245628,22.361835,Cũ
808,203F02,(QNH) Trung tâm Quảng Yên,Quảng Ninh,Thị xã Quảng Yên,"Số 133 Nguyễn Bình, phường Quảng Yên, thị xã Quảng Yên, Quảng Ninh",106.82268,20.93983,Cũ
809,237K01,(THA) Cẩm Thủy,Thanh Hóa,Huyện Cẩm Thủy,"TDP Hoàng Giang, Thị trấn Phong Sơn, Huyện Cẩm Thủy, Thanh hóa",105.476,20.2112,Cũ
810,251F02,(ĐNI) Phú Bình,Đồng Nai,Thành Phố Long Khánh,"Thửa đất số 274, tờ bản đồ số 1, Khu Phố 2, Phường Phú Bình, Thành Phố Long Khánh, Đồng Nai",107.236843,10.918529,Cũ
811,251A29,(ĐNI) Tân Vạn,Đồng Nai,Thành phố Biên Hoà,"353 Bùi Hữu Nghĩa, Phường Tân Vạn, Thành phố Biên Hoà, Đồng Nai",106.8255582,10.91772935,Cũ
812,251A17,(ĐNI) Tân Hiệp,Đồng Nai,Thành phố Biên Hoà,"23 Hẻm 662, Phường Trảng Dài, Thành phố Biên Hòa, Đồng Nai",106.854234,10.970567,Cũ
813,297H02,(KGG) Hòn Đất 2,Kiên Giang,Huyện Hòn Đất,"Khu phố Đường Hòn,Thị trấn Hòn Đất,, Huyện Hòn Đất, Kiên Giang",105.011712,10.128889,Cũ
814,297D01,(KGG) Giang Thành,Kiên Giang,Huyện Giang Thành,"Ấp Khánh Hòa, Xã Tân Khánh Hòa, Huyện Giang Thành, Kiên Giang",104.639288,10.521043,Cũ
815,258D02,(KHH) Mỹ Ca,Khánh Hòa,Thành phố Cam Ranh,"196 Nguyễn Chí Thanh, TDP Nghĩa Cam, Phường Cam Nghĩa, Thành phố Cam Ranh, Khánh Hòa",109.1922634,11.98790993,Cũ
816,258F02,(KHH) Tu Bông,Khánh Hòa,Huyện Vạn Ninh,"Xã Vạn Long, huyện Vạn Ninh, tỉnh Khánh Hòa",109.31266,12.77761,Cũ
817,229H01,(NBH) Hoa Lư,Ninh Bình,Thành phố Ninh Bình,"Phố Khánh Bình,Phường Ninh Khánh,Thành Phố Ninh Bình, Ninh Bình",105.9617,20.27916,Cũ
818,263G05,(LĐG) Đà Loan,Lâm Đồng,Huyện Đức Trọng,"Thôn Đà Giang, Xã Đà Loan, Huyện Đức Trọng , Lâm Đồng",108.390109,11.57662,Cũ
819,237L01,(THA) Bá Thước,Thanh Hóa,Huyện Bá Thước,"SN 53 Phố 4, Thị trấn Cành Nàng, Huyện Bá Thước, Thanh Hóa",105.230822,20.34766988,Cũ
820,203H02,(QNH) Bình Liêu,Quảng Ninh,Huyện Bình Liêu,"Khu Bình Công 2, Thị trấn Bình Liêu, huyện Bình Liêu, tỉnh Quảng Ninh",107.3954954,21.5259728,Cũ
821,228H01,(NĐH) Mỹ Lộc,Nam Định,Huyện Mỹ Lộc,"Thị trấn Mỹ Lộc, Huyện Mỹ Lộc, Nam Định",106.105189,20.439005,Cũ
822,226E01,(HNM) Bình Lục,Hà Nam,Huyện Bình Lục,"Thôn Cửa, xã Trung Lương, Huyện Bình Lục, Hà Nam",106.051147,20.476274,Cũ
823,296F03,(AGG) Mỹ Phước,An Giang,Thành phố Long Xuyên,"Đường Hoàng Văn Thái, Phường Mỹ Phước, Thành phố Long Xuyên, Tỉnh An Giang",105.4306361,10.3667301,Cũ
824,211D01,(VPC)Lập Thạch,Vĩnh Phúc,Huyện Lập Thạch,"Tổ dân phố Tân Chiền, Thị Trấn Lập Thạch, Huyện Lập Thạch, Vĩnh Phúc",105.4663903,21.41606396,Cũ
825,297E02,(KGG) Giồng Riềng 2,Kiên Giang,Huyện Giồng Riềng,"Ấp Hai Lành, xã Ngọc Hòa, huyện Giồng Riềng, Kiên Giang",105.423367,9.866722,Cũ
826,297M01,(KGG) Tân Hiệp,Kiên Giang,Huyện Tân Hiệp,"Khu phố Đông An, TT. Tân Hiệp, H.Tân Hiệp, T. Kiên Giang",105.286209,10.118325,Cũ
827,215J01,(ĐBN) Nậm Pồ,Điện Biên,Huyện Nậm Pồ,"Bản Nà Hỳ 2, xã Nà Hỳ, huyện Nậm Pồ, tỉnh Điện Biên",102.763299,21.808071,Cũ
828,215G01,(ĐBN) Mường Nhé,Điện Biên,Huyện Mường Nhé,"Tổ 1, Xã Mường Nhé, Huyện Mường Nhé, Điện Biên",102.4578,22.1936,Cũ
829,276C02,(TNH)Xã Phước Đông,Tây Ninh,Huyện Gò Dầu,"Thửa Đất 247, Tờ Bản đồ 47 Phước Đức A , Xã Phước Đông, Huyện Gò Dầu, Tây Ninh",106.324807,11.119455,Cũ
830,276D01,(TNH)Huyện Trảng Bàng,Tây Ninh,Thị Xã Trảng Bàng,17 Khu phố Lộc An – Phường Trảng Bàng – Thị Xã Trảng Bàng – Tây Ninh,106.351484,11.035219,Cũ
831,276E01,(TNH) Bến Cầu,Tây Ninh,Huyện Bến Cầu,"Thửa đất số 37, Tờ bản đồ số 39 Khu Phố 4, Thị Trấn Bến Cầu, Huyện Bến Cầu, Tỉnh Tây Ninh",106.1712758,11.1106783,Cũ
832,276D02,(TNH) An Tịnh,Tây Ninh,Thị Xã Trảng Bàng,"Số 1612, QL22, ấp An Bình, Phường An Tịnh, Thị Xã Trảng Bàng, tỉnh Tây Ninh",106.3938165,11.0211786,Cũ
833,274B05,(BDG)Đất Thánh,Bình Dương,Thành phố Thuận An,"1/187 Hòa Lân 1, Phường Thuận Giao, Thành phố Thuận An, Bình Dương",106.703733,10.953425,Cũ
834,274B04,(BDG)Lái Thiêu,Bình Dương,Thành phố Thuận An,"61B Cách mạng tháng 8, Phường Lái Thiêu, Thành phố Thuận An, Bình Dương",106.7018874,10.891789,Cũ
835,274X03,(BDG) DC Thuận Giao,Bình Dương,Thành phố Thuận An,"khu dân cư Thuận Giao, Phường Thuận Giao,Thành phố Thuận An, Bình Dương",106.711029,10.964532,Cũ
836,274B09,(BDG) Bình Chuẩn,Bình Dương,Thành phố Thuận An,"45/19 Thủ Khoa Huân, Kp Bình Phú, Phường Bình Chuẩn, Thành phố Thuận An, Bình Dương",106.7177695,10.9764122,Cũ
837,215B01,(ĐBN) Mường Chà,Điện Biên,Huyện Mường Chà,"Số 29 Tổ 4 Thị trấn Mường Chà, Huyện Mường Chà, Điện Biên",103.0902634,21.7530079,Cũ
838,236D01,(ĐNG)Lê Đình Lý,Đà Nẵng,Quận Thanh Khê,"212 Kỳ Đồng, Phường Thanh Khê Đông, Quận Thanh Khê, Đà Nẵng",108.1857993,16.06991291,Cũ
839,251I01,(ĐNI) Tân Phú,Đồng Nai,Huyện Tân Phú,"1619 Thọ Lâm 3, Xã Phú Xuân, Huyện Tân Phú, Tỉnh Đồng Nai",107.493213,11.289157,Cũ
840,251B02,(ĐNI)Trần Phú,Đồng Nai,Huyện Trảng Bom,"Hẻm 168, Đường An Dương Vương, Khu phố 3, Thị trấn Trảng Bom, Huyện Trảng Bom, Tỉnh Đồng Nai",106.9963615,10.96549801,Cũ
635,024K05,(HNI) Yên Nghĩa,Hà Nội,Quận Hà Đông,"NO-07-LK351 Khu A – Khu đất dịch vụ Do Lộ, phường Yên Nghĩa, quận Hà Đông, thành phố Hà Nội",105.748324,20.952197,Cũ
842,293B01,(HGG) Châu Thành A,Hậu Giang,Huyện Phụng Hiệp,"Ấp Nhất, xã Thạnh Hòa, Huyện Phụng Hiệp, Hậu 
Giang",105.715012,9.919263,Cũ
843,293F01,(HGG) Phụng Hiệp,Hậu Giang,Huyện Phụng Hiệp,"Đường Hùng Vương, Ấp Mỹ Quới, Thị trấn Cây Dương, Huyện Phụng Hiệp, Hậu Giang",105.74044,9.781911,Cũ
844,239C02,(HTH) Hương Sơn 2,Hà Tĩnh,Huyện Hương Sơn,"Thị trấn Tây Sơn, Huyện Hương Sơn, Hà Tĩnh",105.306417,18.457783,Cũ
845,210B01,(PTO)Thị xã PTO,Phú Thọ,Thị xã Phú Thọ,"Khu Đồng Nhà Mạch, Xã Thanh Minh, Thị xã Phú Thọ, Phú Thọ",105.229711,21.403751,Cũ
846,210A05,(PTO)Vân Cơ,Phú Thọ,Thành phố Việt Trì,"SN 3064 Đại lộ Hùng Vương P. Vân Phú, thành phố Việt Trì, tỉnh Phú Thọ",105.35144,21.359474,Cũ
847,238Q02,(NAA) Tuần,Nghệ An,Huyện Quỳnh Lưu,"Xóm Tuần B, Xã Quỳnh Châu, Huyện Quỳnh Lưu, Nghệ An",105.5403164,19.21390109,Cũ
848,274B03,(BDG)An Phú,Bình Dương,Thành phố Thuận An,"D20 Khu dân cư Vietsing, KP4, Phường An Phú, Thành phố Thuận An, Bình Dương",106.735145,10.948242,Cũ
849,274D01,(BDG)Tân Vĩnh Hiệp,Bình Dương,Thị xã Tân Uyên,"DT 746 số 56 tổ 9, ấp Hóa Nhựt, Phường Tân Vĩnh Hiệp, Thành phố Tân Uyên, Bình Dương",106.6685593,10.9889359,Cũ
850,274C05,(BDG) Làng Đại Học,Bình Dương,Thành phố Dĩ An,"Số nhà D81, tổ dân phố 710, Khu phố Tân Lập, Phường Đông Hòa, Thành phố Dĩ An, Bình Dương",106.8074673,10.8797369,Cũ
851,274C06,(BDG) TT Dĩ An,Bình Dương,Thành phố Dĩ An,"Thửa đất số 4365, Tờ bản đồ số 2AB.9, Kp Nhị Đồng 1, Phường Dĩ An, Thành phố Dĩ An, Bình Dương",106.757562,10.904665,Cũ
852,274C07,(BDG) Bình Thắng,Bình Dương,Thành phố Dĩ An,"341/8 Đường Quốc Lộ 1K, KP Nội Hóa 1, Phường Bình An, Thành phố Dĩ An, Bình Dương",106.791299,10.897976,Cũ
853,274F01,(BDG) Phú Giáo,Bình Dương,Huyện Phú Giáo,"608 ĐT 741, KP1, Thị trấn Phước Vĩnh, Huyện Phú Giáo, Bình Dương",106.793,11.289,Cũ
854,271K01,(BPC) Hớn Quản,Bình Phước,Huyện Hớn Quản,"Tổ 8, Khu phố 1, Thị trấn Tân Khai, Huyện Hớn Quản, Bình Phước",106.6147469,11.5628745,Cũ
855,229E02,(NBH) Tân Bình,Ninh Bình,Huyện Yên Mô,"Xã Mai Sơn, Huyện Yên Mô, Tỉnh Ninh Bình",105.9563977,20.1755028,Cũ
856,216J01,(YBI) Thác Bà,Yên Bái,Huyện Yên Bình,"Tổ 2, Thị trấn Thác Bà, Huyện Yên Bình, Yên Bái",105.0418405,21.747406,Cũ
857,219H01,(TPH) Hoàng Su Phì,Hà Giang,Huyện Hoàng Su Phì,"Số nhà 60 Tổ 4, Thị trấn Vinh Quang, Huyện Hoàng Su Phì, Hà Giang",104.6752238,22.7400767,Cũ
858,234G01,(HUE) Phong Điền,Thừa Thiên – Huế,Huyện Phong Điền(TTH),"05 Bùi Dục Tài, thị trấn Phong Điền, 
huyện Phong Điền, tỉnh Thừa Thiên Huế",107.366009,16.583587,Cũ
859,207C01,(TQG) Na Hang,Tuyên Quang,Huyện Nà Hang,"Tổ 10, Thị trấn Na Hang, Huyện Nà Hang, Tuyên Quang",105.3637533,22.3525271,Cũ
860,207B01,(TQG) Lâm Bình,Tuyên Quang,Huyện Lâm Bình,"thôn Nà Khà, xã Lăng Can, huyện Lâm Bình, tỉnh Tuyên Quang",105.219221,22.471906,Cũ
861,234C02,(HUE) Quảng Điền,Thừa Thiên – Huế,Huyện Quảng Điền,"128 Nguyễn Vịnh , tt Sịa, huyện Quảng Điền, TT.Huế",107.512202,16.577356,Cũ
862,262A06,(ĐLK) Ông Ích Khiêm,Đắk Lắk,Thành phố Buôn Ma Thuột,"04 Phan Đăng Lưu, Phường Tân An, Thành phố Buôn Ma Thuột, Đắk Lắk",108.061675,12.698435,Cũ
863,028D02,(HCM) Xóm Chiếu,Hồ Chí Minh,Quận 4,"A95 Nguyễn Thần Hiến, Phường 18, Quận 4, Hồ Chí Minh",106.716452,10.7547038,Cũ
864,276A02,(TNH)Thị xã TNH 2,Tây Ninh,Thành phố Tây Ninh,"182 Trưng Nữ Vương, Khu Phố 5, Phường 1, TP Tây Ninh, Tây Ninh",106.084587,11.310368,Cũ
865,028H01,(HCM)Tạ Quang Bửu,Hồ Chí Minh,Quận 8,"01 Hồ Biểu Chánh, Phường 4, Quận 8, Hồ Chí Minh",106.6713375,10.74194668,Cũ
866,215F01,(ĐBN) Mường Lay,Điện Biên,Thị xã Mường Lay,"Số 228, tổ 1, Phường Na Lay, Thị xã Mường Lay, Điện Biên",103.1513327,22.02259058,Cũ
867,258E02,(KHH) Ninh Sim,Khánh Hòa,Thị xã Ninh Hòa,"Thôn Tân Khánh 2, Xã Ninh Sim, Thị xã Ninh Hòa, Tỉnh Khánh Hòa",109.017722,12.537082,Cũ
868,251D02,(ĐNI) Phước Thái,Đồng Nai,Huyện Long Thành,"Số 58, Xã Long Phước, Huyện Long Thành, Tỉnh Đồng Nai",107.004724,10.711774,Cũ
869,251A24,(ĐNI) An Phước,Đồng Nai,Huyện Long Thành,"đường Lý Thường Kiệt ,ấp 5, Xã Tam An, Huyện Long Thành, Đồng Nai",106.929247,10.807026,Cũ
870,225H06,(HPG) Chợ Tổng,Hải Phòng,Huyện Thủy Nguyên,"Chợ Tổng, Xã Lưu Kiếm, Huyện Thủy Nguyên, Hải Phòng",106.672981,20.97019,Cũ
871,225H01,(HPG)Phố Mới,Hải Phòng,Huyện Thủy Nguyên,"Số 55 Phố Mới, Ngã 3 VSIP, Xã Tân Dương, Huyện Thủy Nguyên, Hải Phòng",106.672631,20.90379,Cũ
872,211E01,(VPC) Tam Dương,Vĩnh Phúc,Huyện Tam Dương,"Thửa đất số 15, Khu Đồng Bông, Thị trấn Hợp Hòa, Huyện Tam Dương, Vĩnh Phúc",105.5428775,21.38352458,Cũ
873,238Q03,(NAA) Quỳnh Minh,Nghệ An,Huyện Quỳnh Lưu,"Xóm 8 Xã Quỳnh Hậu, Huyện Quỳnh Lưu, Nghệ An",105.6432303,19.1606375,Cũ
874,238Q01,(NAA) Cầu Giát,Nghệ An,Huyện Quỳnh Lưu,"Thôn 3, Xã Quỳnh Giang, Huyện Quỳnh Lưu, Nghệ An",105.622778,19.138333,Cũ
875,215I01,(ĐBN) Điện Biên Đông,Điện Biên,Huyện Điện Biên Đông,"Tổ 5 thị trấn Điện Biên Đông , Huyện Điện Biên Đông , Điện Biên",103.2202032,21.2956218,Cũ
876,293B02,(HGG) Một Ngàn,Hậu Giang,Huyện Châu Thành A(HG),"Đường 30/4, Thị trấn Một Ngàn, Huyện Châu Thành A, Tỉnh Hậu Giang",105.63629,9.92509,Cũ
877,218A02,(HBH) Hữu Nghị,Hòa Bình,Thành phố Hòa Bình,"144 Hòa Bình, Phường Tân Hòa, Thành phố Hòa Bình, Hòa Bình",105.335029,20.836548,Cũ
878,028P01,(HCM)340,Hồ Chí Minh,Huyện Cần Giờ,"340 Ấp Bình Phước, Xã Bình Khánh, Huyện Cần Giờ, TP.HCM",106.786915,10.644028,Cũ
879,291F01,(BLU) Hòa Bình,Bạc Liêu,Huyện Hòa Bình,"Ấp thị trấn A1, TT Hòa Bình, huyện Hòa Bình, tỉnh Bạc Liêu",105.6363041,9.2840865,Cũ
880,208G01,(TNN) Phú Lương,Thái Nguyên,Huyện Phú Lương,"Tiểu khu Trần Phú, Thị trấn Đu, Huyện Phú Lương, Thái Nguyên",105.7011423,21.7224054,Cũ
881,211H01,(VPC)Tam Sơn,Vĩnh Phúc,Huyện Sông Lô,"khu 4, tổ dân phố Lạc Kiều,Thị Trấn Tam Sơn- Huyện Sông Lô- VP",105.4081184,21.41880261,Cũ
882,234E01,(HUE) Phú Vang,Thừa Thiên – Huế,Thành phố Huế,"41 Kinh Dương Vương, Phường Thuận An, Thành phố Huế, Thừa Thiên – Huế",107.6404199,16.54816667,Cũ
883,207E01,(TQG) Hàm Yên,Tuyên Quang,Huyện Hàm Yên,"172 Cầu Mới, Thị trấn Tân Yên, Huyện Hàm Yên, Tuyên Quang",105.0301972,22.0635217,Cũ
884,225K01,(HPG) Thị trấn Tiên Lãng,Hải Phòng,Huyện Tiên Lãng,Khu VII thị trấn Tiên Lãng,106.552673,20.725644,Cũ
957,024K06,(HNI) Mỗ Lao,Hà Nội,Quận Hà Đông,"Số nhà 86 Thanh Bình, TDP số 9, phường Mộ Lao, Quận Hà Đông, Hà Nội",105.7801083,20.97921737,Cũ
958,024K04,(HNI) Lê Trọng Tấn,Hà Nội,Quận Hà Đông,L08-24 Khu Đô Thị Dương Nội - La Khê - Hà Đông - Hà Nội,105.7580705,20.9756388,Cũ
976,024K08,(HNI) Văn Phú,Hà Nội,Quận Hà Đông,"TT23-15, Khu đô thị Văn Phú, phường Phú La, quận Hà Đông, Hà Nội",105.7723344,20.9560305,Cũ
1079,024K09,(HNI) Dương Nội,Hà Nội,Quận Hà Đông,"C11-O24 khu C khu đô thị geleximco, Phường Dương Nội, Quận Hà Đông, Hà Nội",105.739808,20.98597103,Cũ
889,211A02,(VPC) Đồng Tâm,Vĩnh Phúc,Thành phố Vĩnh Yên,"377 Lam Sơn, Phường Đồng Tâm, Thành Phố Vĩnh Yên, Vĩnh Phúc",105.586728,21.292552,Cũ
890,262O01,(ĐLK) EaSup,Đắk Lắk,Huyện Ea Súp,"54 Âu Cơ, Thị trấn Easup, huyện Easup, Đắc Lắc",107.882425,13.072845,Cũ
1090,024K03,(HNI)Phú Lãm,Hà Nội,Quận Hà Đông,Lô 06 LK12 Khu đấu giá giá phú lương 2- Phú lương- Hà Đông - Hà Nội,105.762,20.934444,Cũ
1091,024K07,(HNI) Phúc La,Hà Nội,Quận Hà Đông,"Số 9, Nhà vườn 2 , tổng cục 5 Yên Xá ,xã Tân Triều, huyện Thanh Trì ,thành phố Hà Nội",105.7966,20.973764,Cũ
893,277B02,(ĐTP) Mỹ Thọ,Đồng Tháp,Huyện Cao Lãnh,"Số 16 đường 30 tháng tư Thị trấn Mỹ Thọ, Huyện Cao Lãnh, tỉnh Đồng Tháp",105.698807,10.440266,Cũ
894,216E01,(YBI) Trạm Tấu,Yên Bái,Huyện Trạm Tấu,"số nhà 99 , tổ dân phố số 2, thị trấn Trạm Tấu, huyện Trạm Tấu, Yên Bái",104.379806,21.464333,Cũ
895,216I01,(YBI) Mù Cang Chải,Yên Bái,Huyện Mù Cang Chải,Tổ 4 - TT Mù Cang Chải - Huyện Mù Cang Chải - Tỉnh Yên Bái,104.084677,21.852278,Cũ
896,292B02,(CTO)Quốc Lộ 1,Cần Thơ,Quận Cái Răng,"265B Trần Hưng Đạo, Phường Lê Bình, Quận Cái Răng, Cần Thơ",105.7506609,9.9916385,Cũ
897,211A01,(VPC) Vĩnh Yên,Vĩnh Phúc,Thành phố Vĩnh Yên,"Khu đất dịch vụ thôn Hán Lữ, Phường Khai Quang, Thành phố Vĩnh Yên, Vĩnh Phúc",105.6245211,21.32049501,Cũ
898,211B02,(VPC) Xuân Hòa,Vĩnh Phúc,Thành phố Phúc Yên,"Lô 1181 Lê Quang Đạo, Phường Xuân Hòa, Thành phố Phúc Yên, Vĩnh Phúc",105.7210104,21.2791252,Cũ
899,211B01,(VPC) Phúc Yên,Vĩnh Phúc,Thành phố Phúc Yên,"Đường Bạch Đằng, KĐT Hùng Vương, Hùng Vương, Thành phố Phúc Yên, Vĩnh Phúc",105.4210251,21.1342473,Cũ
16,024B02,(HNI)Bách Khoa,Hà Nội,Quận Hai Bà Trưng,"214 Lê Thanh Nghị, Phường Đồng Tâm, Quận Hai Bà Trưng, Hà Nội",105.842995,21.0017539,Cũ
901,219C01,(HGG) Mèo Vạc,Hà Giang,Huyện Mèo Vạc,"10A1 Đường Nguyễn Thị Minh Khai, tổ 2, TT Mèo Vạc, Huyện Mèo Vạc, Tỉnh Hà Giang",105.408469,23.162631,Cũ
17,024B03,(HNI) Thanh Nhàn,Hà Nội,Quận Hai Bà Trưng,"211 phố Lạc Nghiệp, P.Thanh Nhàn, Q. Hai Bà Trưng, Tp. Hà Nội",105.8566726,21.0079213,Cũ
903,261G01,(DKG) Tuy Đức,Đắk Nông,Huyện Tuy Đức,"Thôn 4 , xã Đắk Búk So, huyện Tuy Đức,  tỉnh Đắk Nông",107.461652,12.209511,Cũ
904,028G11,(HCM) Tân Hưng,Hồ Chí Minh,Quận 7,"53 đường số 13, Phường Tân Kiểng, Quận 7, Hồ Chí Minh",106.704526,10.74648,Cũ
905,218H01,(HBH) Yên Thủy,Hòa Bình,Huyện Yên Thủy,"258 Khu Phố Thanh Bình, Thị trấn Hàng Trạm, Huyện Yên Thuỷ, Hoà Bình",105.612483,20.3958037,Cũ
906,261C02,(DKG) Nhân Cơ,Đắk Nông,Huyện Đăk Rlâp,"Thôn 7, Xã Nhân Cơ, Huyện Đăk Rlâp, Đắk Nông",107.57837,11.981,Cũ
907,235H01,(QNM) Hà Lam,Quảng Nam,Huyện Thăng Bình,"Ngã ba Bình Quý, Xã Bình Quý, Huyện Thăng Bình, Quảng Nam",108.34097,15.71385101,Cũ
908,235F01,(QNM) Quế Sơn,Quảng Nam,Huyện Quế Sơn,"70 Phan Châu Trinh, Thị trấn Đông Phú, Huyện Quế Sơn, Quảng Nam",108.2151029,15.67201909,Cũ
909,235D01,(QNM) Phú Ninh,Quảng Nam,Huyện Phú Ninh,"Thôn Cây Sanh, Xã Tam Dân, huyện Phú Ninh, T.Quảng Nam",108.42122,15.524526,Cũ
910,235C01,(QNM) Núi Thành,Quảng Nam,Huyện Núi Thành,"351 Phạm Văn Đồng, Thị trấn Núi Thành, Huyện Núi Thành, Quảng Nam",108.6546987,15.43194907,Cũ
911,225F01,(HPG)Mạc Đăng Doanh,Hải Phòng,Quận Dương Kinh,"89 Mạc Đăng Doanh, Phường Hưng Đạo, Quận Dương Kinh, Hải Phòng",106.6983544,20.7960554,Cũ
912,239D02,(HTH) Cẩm Xuyên 2,Hà Tĩnh,Huyện Cẩm Xuyên,"Thôn 10 Cẩm Trung, H Cẩm Xuyên, Hà Tĩnh",106.091667,18.216389,Cũ
913,251G01,(ĐNI) Định Quán,Đồng Nai,Huyện Định Quán,"Khu Phố Hiệp Tâm 2,TT Định Quán, Huyện Định Quán,Tỉnh Đồng Nai",107.351257,11.201083,Cũ
914,216H01,(YBI) Trấn Yên,Yên Bái,Huyện Trấn Yên,"Số nhà 436 đường phạm văn đồng, TT Cổ Phúc, H Trấn Yên, Tỉnh Yên Bái",104.82362,21.75931,Cũ
915,211D02,(VPC) Lập Thạch 2,Vĩnh Phúc,Huyện Lập Thạch,"Thửa đất số 404 tờ bản đồ số 9, Thôn Vọng Sơn, xã Triệu Đề, huyện Lập Thạch, tỉnh Vĩnh Phúc",105.462969,21.335434,Cũ
916,236C01,(ĐNG)NguyenLuongBang,Đà Nẵng,Quận Liên Chiểu,"230/06 Tôn Đức Thắng, Phường Hòa Minh, Quận Liên Chiểu, Đà Nẵng",108.1561729,16.06497494,Cũ
917,232D02,(QBH) Bố Trạch,Quảng Bình,Huyện Bố Trạch,"Xã Phúc Trạch, Bố Trạch, Quảng Bình",106.2741169,17.64671767,Cũ
918,221H01,(HYN) Ân Thi,Hưng Yên,Huyện Ân Thi,"51 Phạm Ngũ Lão, Thị Trấn Ân Thi, Huyện Ân Thi, Tỉnh Hưng Yên",106.089828,20.818674,Cũ
919,251J01,(ĐNI) Vĩnh An,Đồng Nai,Huyện Vĩnh Cửu,"DT 767 , KP 7 Thị trấn Vĩnh An, Huyện Vĩnh Cửu, Đồng Nai",107.024825,11.059923,Cũ
920,225J01,(HPG) Vĩnh Bảo - Đông Thái I,Hải Phòng,Huyện Vĩnh Bảo,"Đối diện bến xe Vĩnh Bảo, Xã Nhân Hòa, Thị Trấn Vĩnh Bảo, Huyện Vĩnh Bảo, Hải Phòng",106.4802321,20.68121035,Cũ
921,261E01,(DKG) Đăk Song,Đắk Nông,Huyện Đăk Song,"Tổ 4, TT Dức An, Huyện Đăk Song, Đăk Nông",107.613919,12.250054,Cũ
