STT,Mã BC,Name,Tỉnh,Quận/Huyện/TP/Thị xã,Địa chỉ,Longitude,Latitude,Note
1,232A01,(QBH)Bắc Lý,Quảng Bình,Thành phố Đồng Hới,"89 Lê Lợi, Phường Hải Đình, Thành Phố Đồng Hới, Quảng Bình",106.6218486,17.45959389,Cũ
2,297K01,(KGG) Duơng Đông,Kiên Giang,Thành Phố Phú Quốc,"326 Nguyễn Trung Trực , Khu Phố 5 , P . Dương Đông , TP. Phú Quốc , Kiên Giang",103.978444,10.228111,Cũ
3,221C03,(HYN) Phùng Hưng,Hưng Yên,Huyện Khoái Châu,"Đường 205, thôn Sài Thị, Xã Thuần Hưng, huyện Khoái Châu, tỉnh Hưng Yên",105.996005,20.781528,Cũ
4,258D01,(KHH)Cam Ranh,Khánh Hòa,Thành phố Cam Ranh,"2274 Hùng Vương, phường Ba Ngòi, Tp Cam Ranh, Tỉnh Khánh Hòa",109.138246,11.915079,Cũ
5,237I02,(THA) Thiệu Hóa 2,Thanh Hóa,Huyện Thiệu Hóa,"Xã Thiệu Phú, Huyện Thiệu Hoá, Thanh Hoá",105.6783616,19.9066717,Cũ
6,237I01,(THA) Thiệu Hóa,Thanh Hóa,Huyện Thiệu Hóa,"SN 19 đường 515 Thôn 1, Xã Thiệu Vận, Huyện Thiệu Hóa, Thanh Hóa",105.676472,19.865944,Cũ
7,222F02,(BNH) Công Hà,Bắc Ninh,Huyện Thuận Thành,"Công Hà, Phường Hà Mãn, Thị xã Thuận Thành, Bắc Ninh",106.03302,21.03304,Cũ
736,024U02,(HNI) Ba Trại,Hà Nội,Huyện Ba Vì,"Thửa đất số 34-1, tờ bản đồ số 41, Thôn 7, xã Ba Trại, H. Ba Vì, Hà Nội",105.3718039,21.12022618,Cũ
737,024U01,(HNI)Chu Minh,Hà Nội,Huyện Ba Vì,"Khu Đồng Cống, Thị trấn Tây Đằng, Huyện Ba Vì, Hà Nội",105.414837,21.203268,Cũ
10,225B01,(HPG)Ngô Gia Tự,Hải Phòng,Quận Hải An,"369 Lũng Đông, Phường Đằng Hải, Quận Hải An, Hải Phòng",106.7288424,20.8393647,Cũ
11,225B03,(HPG) Trần Hưng Đạo,Hải Phòng,Quận Hải An,"Tổ dân phố Bình Kiều 1, Phường Đông Hải 2, Quận Hải An, TP Hải Phòng",106.72075,20.84919,Cũ
659,024X01,(HNI)Chúc Sơn,Hà Nội,Huyện Chương Mỹ,"Km 20, Quốc Lộ 6, Thị trấn Chúc Sơn, Huyện Chương Mỹ, Hà Nội",105.706676,20.924617,Cũ
735,024X02,(HNI)Xuân Mai,Hà Nội,Huyện Chương Mỹ,"Số nhà 129, Tổ 2 Tân Xuân, Thị Trấn Xuân Mai, Huyện Chương Mỹ, Hà Nội",105.5780953,20.907772,Cũ
569,024S01,(HNI) TT Phùng,Hà Nội,Huyện Đan Phượng,"số 61 Tây Sơn,Thị trấn Phùng, huyện Đan Phượng, Hà Nội",105.6759182,21.08199888,Cũ
90,024O01,(HNI)Cao Lỗ,Hà Nội,Huyện Đông Anh,"Số nhà 12 đường Việt Hùng, Xã Uy Nỗ, Huyện Đông Anh, Hà Nội",105.868887,21.1379953,Cũ
483,024O02,(HNI)Hậu Dưỡng,Hà Nội,Huyện Đông Anh,"Số 112 đường Đồng Quan, Xã Kim Nỗ, Huyện Đông Anh, Hà Nội",105.790498,21.13497,Cũ
658,024O04,(HNI) Khối 3A,Hà Nội,Huyện Đông Anh,"QL3 Số 4 Tổ 15, Thị trấn Đông Anh, Huyện Đông Anh, Hà Nội",105.84677,21.163723,Cũ
1069,024O05,(HNI) Hải Bối,Hà Nội,Huyện Đông Anh,"Thôn Đồng Nhân, xã Hải Bối, huyện Đông Anh, thành phố Hà Nội",105.803042,21.118608,Cũ
25,024N07,(HNI) Ninh Hiệp,Hà Nội,Huyện Gia Lâm,"Số 80A, ngõ 130 đường Hồ Sen, xã Yên Viên, Huyện Gia Lâm, TP Hà Nội",105.919506,21.082898,Cũ
84,024N08,(HNI) Kiêu Kỵ,Hà Nội,Huyện Gia Lâm,"Số 40 ,Sao biển 24 Vinhomes Ocean Park, Xã Kiêu Kỵ, Huyện Gia Lâm, Hà Nội",105.951546,20.998968,Cũ
104,024N06,(HNI) Đa Tốn,Hà Nội,Huyện Gia Lâm,"133 đường Đa Tốn, Thôn Thuận Tốn, Xã Đa Tốn, Huyện Gia Lâm, Hà Nội",105.9278902,20.9855729,Cũ
22,277H02,(ĐTP) Sa Đéc 2,Đồng Tháp,Thành phố Sa Đéc,"63/68 ấp Đông Huề, Xã Tân Khánh Đông, Tp Sa Đéc, Tỉnh Đồng Tháp",105.71714,10.368902,Cũ
23,225L02,(HPG) An Hưng,Hải Phòng,Huyện An Dương,"Xóm Nam Bình, xã An Hưng, huyện An Dương, thành phố Hải Phòng",106.5811183,20.89892494,Cũ
24,220F03,(HDG) Thanh Giang,Hải Dương,Huyện Thanh Miện,"Xóm 4, Thôn Phù Tải 2, Xã Thanh Giang, Huyện Thanh Miện, Hải Dương",106.25087,20.71796,Cũ
105,024M01,(HNI)Cổ Bi,Hà Nội,Huyện Gia Lâm,"138 Cổ Bi, Phường Cổ Bi, Huyện Gia Lâm, Hà Nội",105.940232,21.025779,Cũ
26,203F03,(QNH) Minh Thành,Quảng Ninh,Thị xã Quảng Yên,"Đường Mạc Đăng Doanh, Phường Đông Mai, Thị Xã Quảng Yên, Quảng Ninh",106.837889,21.007361,Cũ
27,290I01,(CMU) U Minh,Cà Mau,Huyện U Minh,"Khóm 3, Thị Trấn U Minh, huyện U Minh, Tỉnh Cà Mau",104.962761,9.403705,Cũ
28,290H01,(CMU) Ngọc Hiển,Cà Mau,Huyện Ngọc Hiển,"Khóm 1, TT Gạch Gốc, huyện Ngọc Hiển, tỉnh Cà Mau",105.01854,8.619659,Cũ
29,290G02,(CMU) Phú Thuận,Cà Mau,Huyện Phú Tân(CM),"Ấp Vàm Đình, xã Phú Thuận, huyện Phú Tân, Cà Mau",104.940395,8.917159,Cũ
30,290G01,(CMU) Phú Tân,Cà Mau,Huyện Phú Tân(CM),"Khóm 2, Thị trấn Cái Đôi Vàm, Huyện Phú Tân, Cà Mau",104.817547,8.854884,Cũ
31,290F02,(CMU) Thới Bình 2,Cà Mau,Huyện Thới Bình,"Khóm 1, Thị trấn Thới Bình, Huyện Thới Bình, Cà Mau",105.090684,9.348544,Cũ
32,290F01,(CMU) Thới Bình,Cà Mau,Huyện Thới Bình,"Ấp Kinh 5B, xã Tân Phú, huyện Thới Bình, tỉnh Cà Mau",105.195654,9.378268,Cũ
33,290E03,(CMU) Trần Hợi,Cà Mau,Huyện Trần Văn Thời,"Ấp 2, Xã Trần Hợi, Huyện Trần Văn Thời, Cà Mau",104.914714,9.172091,Cũ
34,290E02,(CMU) Sông Đốc,Cà Mau,Huyện Trần Văn Thời,"Khóm 9, thị trấn Sông Đốc, Huyện Trần Văn Thời, Tỉnh Cà Mau",104.830953,9.044532,Cũ
35,290E01,(CMU) Trần Văn Thời,Cà Mau,Huyện Trần Văn Thời,"Đường số 4, Khóm 1 ,TT Trần Văn Thời, Cà Mau",104.970728,9.074152,Cũ
36,290D02,(CMU) Tân Duyệt,Cà Mau,Huyện Đầm Dơi,"Ấp Bào Sen, xã Tân Duyệt, huyện Đầm Dơi, tỉnh Cà Mau",105.213878,8.934414,Cũ
37,290D01,(CMU) Đầm Dơi,Cà Mau,Huyện Đầm Dơi,"Đường Nguyễn Tạo, Khóm 4, TT. Đầm Dơi, huyện Đầm Dơi, tỉnh Cà Mau",105.196178,8.993978,Cũ
38,290C01,(CMU) Năm Căn,Cà Mau,Huyện Năm Căn,"Đường Nguyễn Tất Thành, Khu vực 1, Khóm 4, Thị trấn Năm Căn, Huyện Năm Căn, Cà Mau",104.99514,8.766978,Cũ
39,290B02,(CMU) Thạnh Phú,Cà Mau,Huyện Cái Nước,"Ấp Tân Hòa, xã Thạnh Phú, huyện Cái Nước, tỉnh Cà Mau",105.079625,9.091954,Cũ
40,290B01,(CMU)Cái Nước,Cà Mau,Huyện Cái Nước,"Khóm 2, Thị trấn Cái Nước, Huyện Cái Nước, Cà Mau",105.011281,8.948381,Cũ
41,290A03,(CMU) Lý Thường Kiệt,Cà Mau,Thành phố Cà Mau,"79 Lý Thường Kiệt, Khóm 7, Phường 6, Thành phố Cà Mau, Cà Mau",105.187587,9.173698,Cũ
42,290A02,(CMU) Nguyễn Tất Thành,Cà Mau,Thành phố Cà Mau,"Đường Nguyễn Đình Chiểu, Phường 8, Thành Phố Cà Mau, Cà Mau",105.145021,9.162962,Cũ
559,024R01,(HNI)Kim Chung,Hà Nội,Huyện Hoài Đức,"Số nhà 43,45 ngõ 69 đường Vạn Xuân, khu ở tái định cư, thôn Lai Xá, Xã Kim Chung, Huyện Hoài Đức, Hà",105.7220849,21.06022112,Cũ
841,024R03,(HNI) Sơn Đồng,Hà Nội,Huyện Hoài Đức,"Thửa đất số 38, tờ bản đồ số 10 thôn Yên Bệ, X. Kim Chung, Hoài Đức, Hà Nội",105.70442,21.05151,Cũ
1152,024R02,(HNI) An Khánh,Hà Nội,Huyện Hoài Đức,"Số nhà 329 Đường An Thượng - Đông La, Thôn Lại Dụ, xã An Thượng, huyện Hoài Đức, thành phố Hà Nội",105.710056,20.980278,Mở mới
557,024N04,(HNI) Thạch Đà,Hà Nội,Huyện Mê Linh,"Đồng Tuyến, thôn 1, xã Thạch Đà, huyện Mê Linh, thành phố Hà Nội",105.678158,21.17848,Cũ
967,024N05,(HNI) Thanh Lâm,Hà Nội,Huyện Mê Linh,"Thôn Phú Nhi, xã Thanh Lâm, huyện Mê Linh, thành phố Hà Nội",105.7383823,21.19854706,Cũ
1163,024N01,(HNI)Tiền Phong,Hà Nội,Huyện Mê Linh,"Khu đô thị Phương Huy, Tiền Phong, Mê Linh, Hà Nội",105.7655567,21.15695234,Mở mới
43,024X03,(HNI) Phúc Lâm,Hà Nội,Huyện Mỹ Đức,"Thôn Chân Chim, xã Phúc Lâm, huyện Mỹ Đức, thành phố Hà Nội",105.691268,20.809008,Cũ
106,024Z01,(HNI)Đại Nghĩa,Hà Nội,Huyện Mỹ Đức,"260, Khu Bãi Dâu, Thị trấn Đại Nghĩa, Huyện Mỹ Đức, Hà Nội",105.7420607,20.68632587,Cũ
101,024Z06,(HNI) Minh Cường,Hà Nội,Huyện Phú Xuyên,"TK Thao Chính, Thị Trấn Phú Xuyên, Huyện Phú Xuyên, Hà Nội",105.906395,20.742321,Cũ
102,024M02,(HNI)Phú Xuyên,Hà Nội,Huyện Phú Xuyên,"Số 24 Kiều Đoài, Xã Đại Xuyên, Huyện Phú Xuyên, Hà Nội",105.910881,20.714882,Cũ
346,024T01,(HNI)Phúc Thọ,Hà Nội,Huyện Phúc Thọ,"Số 148, Tổ dân phố số 4, Thị trấn Phúc Thọ, Huyện Phúc Thọ, Hà Nội",105.540255,21.1104183,Cũ
712,024T02,(HNI) Tam Hiệp,Hà Nội,Huyện Phúc Thọ,"Số nhà 20, Dốc nhà máy đường, xã Tam Hiệp, huyện Phúc Thọ, Hà Nội",105.623308,21.083668,Cũ
55,214A04,(LCI)Phố Mới,Lào Cai,Thành phố Lào Cai,"75 Nguyễn Huệ,Phường Lào Cai, Thành Phố Lào Cai, Lào Cai",103.9683514,22.50527344,Cũ
56,225C05,(HPG) Chợ Hàng,Hải Phòng,Quận Lê Chân,"Số 493 Nguyễn Văn Linh, Phường Dư Hàng Kênh, Quận Lê Chân, Hải Phòng",106.68108,20.83439,Cũ
57,251A30,(ĐNI) Bửu Long,Đồng Nai,Thành phố Biên Hoà,"Thửa đất số 338, tờ bản đồ số 45, Phường Bửu Long, Thành phố Biên Hoà, Tỉnh Đồng Na",106.8066375,10.9581821,Cũ
58,220H03,(HDG) Quang Thành,Hải Dương,Thị Xã Kinh Môn,"Thôn Miêu Nha, Xã Quang Thành, Thị Xã Kinh Môn, Hải Dương",106.42741,20.97775,Cũ
59,218J01,(HBH) Kỳ Sơn,Hòa Bình,Thành phố Hòa Bình,"Cạnh Sắt thép Đông Nga, tổ 7 Phường Kì Sơn, Thành phố Hòa Bình, Hòa Bình",105.34879,20.884462,Cũ
60,273G01,(TGG) Gò Công Tây,Tiền Giang,Huyện Gò Công Tây,"Ấp Bình Đông Trung, Xã Bình Nhì, Huyện Gò Công Tây, Tiền Giang",106.55733,10.356652,Cũ
61,251B04,(ĐNI) Bàu Cá,Đồng Nai,Huyện Trảng Bom,"Xã Trung Hòa, Huyện Trảng Bom, Đồng Nai",107.053221,10.94217,Cũ
62,261D01,(DKG)Đăk Mil,Đắk Nông,Huyện Đăk Mil,"20 Ngô Gia Tự, Thị trấn Đắk Mil, Huyện Đắk Mil, Đăk Nông",107.625792,12.45027,Cũ
63,219A01,(HGG) Minh Khai,Hà Giang,Thành phố Hà Giang,"Số nhà 46, đường Nguyễn Thái Học, Phường Minh Khai, TP Hà Giang",104.985813,22.825634,Cũ
64,220D02,(HDG) Quang Minh,Hải Dương,Huyện Gia Lộc,"Xã Hưng Đạo, huyện Tứ Kỳ, tỉnh Hải Dương",106.27256,20.78729,Cũ
65,299B01,(STG) Vĩnh Châu,Sóc Trăng,Thị xã Vĩnh Châu,"Khu 2, thị trấn Vĩnh Châu, huyện Vĩnh Châu, tỉnh Sóc Trăng",105.97923,9.332812,Cũ
66,254H01,(BRVT) Trường Thành,Bà Rịa – Vũng Tàu,Huyện Đất Đỏ,"Tổ 16 Kp Trường Thành, TT Đất Đỏ, Huyện Đất Đỏ, Tỉnh Bà Rịa -Vũng Tàu",107.2708431,10.4814437,Cũ
67,254F02,(BRVT) Long Hải,Bà Rịa – Vũng Tàu,Huyện Long Điền,"Tổ 6 đường nguyễn tất thành, kp hải bình, Thị Trấn Long Hải, Huyện Long Điền, Bà Rịa-Vũng Tàu.",107.227913,10.408859,Cũ
68,254E01,(BRVT)Ngãi Giao,Bà Rịa – Vũng Tàu,Huyện Châu Đức,"438A Hùng Vương , TT Ngãi Giao , Huyện Châu Đức . Tỉnh Bà Rịa Vũng Tàu",107.2480166,10.65861296,Cũ
69,254D02,(BRVT) Phước Bửu,Bà Rịa – Vũng Tàu,Huyện Xuyên Mộc,"Ấp 1, Xã Hoà Hội, Huyện Xuyên Mộc, Tỉnh Bà Rịa – Vũng Tàu",107.436875,10.594278,Cũ
70,254D01,(BRVT)Phước Hòa,Bà Rịa – Vũng Tàu,Huyện Xuyên Mộc,"226 Huỳnh Minh Thạnh, Thị Trấn Phước Bửu. Huyện Xuyên Mộc, Bà Rịa Vũng Tàu",107.4042539,10.52011417,Cũ
71,254C05,(BRVT) Tóc Tiên,Bà Rịa – Vũng Tàu,Thị xã Phú Mỹ,"Thửa đất số 1030 .tờ bản đồ số 33, Khu phố trảng lớn, Phường Hắc Dịch,Thị xã Phú Mỹ, BR-VT",107.1195809,10.6425072,Cũ
72,254C04,(BRVT) Mỹ Xuân,Bà Rịa – Vũng Tàu,Thị xã Phú Mỹ,"Nguyên Văn Nghị-QL51, Phường Mỹ Xuân, Thị xã Phú Mỹ, Bà Rịa-Vũng Tàu",107.0506835,10.6294432,Cũ
73,254C02,(BRVT)Tân Phước,Bà Rịa – Vũng Tàu,Thị xã Phú Mỹ,"Thôn Phước Hiệp, Xã Tân Hoà, Thị Xã Phú Mỹ, tỉnh Bà Rịa Vũng Tàu",107.085869,10.517944,Cũ
74,254B06,(BRVT) Nguyễn Thiện Thuật,Bà Rịa – Vũng Tàu,Thành phố Vũng Tàu,"Số 10A Hồ Tri Tân, phường Rạch Dừa, thành phố Vũng Tàu, tỉnh Bà Rịa Vũng Tàu",107.107618,10.393157,Cũ
75,254B03,(BRVT) Bình Giã,Bà Rịa – Vũng Tàu,Thành phố Vũng Tàu,"19 Phan Chu Trinh Phường 2, Tp Vũng Tàu, Bà Rịa – Vũng Tàu",107.0798102,10.33837432,Cũ
76,254B02,(BRVT)Nguyễn An Ninh,Bà Rịa – Vũng Tàu,Thành phố Vũng Tàu,"431 Trần Phú, Phường Thắng Nhì, Thành phố Vũng Tàu, Bà Rịa – Vũng Tàu",107.07294,10.37187,Cũ
77,254B01,(BRVT)Ba Mươi Tháng Tư,Bà Rịa – Vũng Tàu,Thành phố Vũng Tàu,"1529B Đường 30/4, Phường 12, Thành Phố Vũng Tàu, Tỉnh Bà Rịa Vũng Tàu",107.151983,10.420414,Cũ
78,254A01,(BRVT)Nguyễn Tất Thành,Bà Rịa – Vũng Tàu,Thành phố Bà Rịa,"307 võ thị sáu, Phường Long Toàn, TP Bà Rịa, BR-VT",107.195977,10.500247,Cũ
79,258E01,(KHH)Ninh Hòa,Khánh Hòa,Thị xã Ninh Hòa,"Hà Thanh 2, Phường Ninh Đa, Thị xã Ninh Hòa, Khánh Hòa",109.187982,12.252577,Cũ
80,291B01,(BLU) Giá Rai,Bạc Liêu,Thị xã Giá Rai,"46 quốc lộ 1A ,khóm 1, Phường Hộ Phòng, Thị xã Giá Rai, Bạc Liêu",105.423342,9.22939,Cũ
81,220F01,(HDG) Thanh Miện,Hải Dương,Huyện Thanh Miện,"Số nhà 500, Nguyễn Lương Bằng, Khu Phố Lê Bình, Thị trấn Thanh Miện, huyện Thanh Miện, Hải Dương",106.245591,20.784576,Cũ
82,226D03,(HNM) Nhật Tựu,Hà Nam,Huyện Duy Tiên,"Khu đô thị Đồng Văn Xanh, Xã Duy Hải, Huyện Duy Tiên, Hà Nam",105.90516,20.64279,Cũ
83,226D01,(HNM) Kim Bảng,Hà Nam,Huyện Kim Bảng,"Tổ 5, Thị trấn Quế Huyện Kim Bảng, Hà Nam",105.87126,20.57918,Cũ
526,024W01,(HNI) Thạch Thán,Hà Nội,Huyện Quốc Oai,"Xóm Gốc Gạo, thôn Ngọc Than, xã Ngọc Mỹ, huyện Quốc Oai, thành phố Hà Nội",105.627472,20.992832,Cũ
85,232A02,(QBH)Tố hữu,Quảng Bình,Thành phố Đồng Hới,336 lý thường kiệt. Phường Bắc lý. Đồng hới,106.604351,17.470112,Cũ
86,237A05,(THA) Quảng Hưng 2,Thanh Hóa,Thành phố Thanh Hóa,Phố 2 phường Quảng Hưng tp Thanh Hoá tỉnh Thanh Hoá,105.805556,19.788611,Cũ
87,258D03,(KHH) Cam Phúc Nam,Khánh Hòa,Thành phố Cam Ranh,"1898 Đại lộ Hùng Vương, Phường Cam Thuận, Thành phố Cam Ranh, Khánh Hòa",109.1876598,11.95624009,Cũ
88,220K03,(HDG) Kim Anh,Hải Dương,Huyện Kim Thành,"Xã Cổ Dũng, Huyện Kim Thành, Hải Dương",106.429722,20.978889,Cũ
805,024W02,(HNI) Hòa Thạch,Hà Nội,Huyện Quốc Oai,"Thửa đất số 31, tờ bản đồ số 110, thôn Thắng Đầu, Xã Hòa Thạch, Huyện Quốc Oai, Hà Nội",105.53748,20.95754,Cũ
89,024P03,(HNI) Minh Trí,Hà Nội,Huyện Sóc Sơn,"Thôn Thắng Trí, xã Minh Trí, huyện Sóc Sơn, thành phố Hà Nội",105.7512553,21.25604259,Cũ
91,258A10,(KHH) Nam Lê Hồng Phong,Khánh Hòa,Thành phố Nha Trang,"709 Lê Hồng Phong, P. Phước Long, TP. Nha Trang, Khánh Hòa",109.148958,12.257056,Cũ
92,220K01,(HDG) Kim Thành,Hải Dương,Huyện Kim Thành,"Số 66, Quốc Lộ 5 , Khu Phố Ga, Thị Trấn Phú Thái,Huyện Kim, Thành Tỉnh Hải Dương",106.516408,20.964959,Cũ
93,213F01,(LCU) Tam Đường,Lai Châu,Huyện Tam Đường,"293 đường Võ Nguyên Giáp,Thị trấn Tam Đường, Huyện Tam Đường, Lai Châu",106.621886,22.322223,Cũ
94,226E02,(HNM) Bối Cầu,Hà Nam,Huyện Bình Lục,"1044 Trần Hưng Đạo, Thị trấn Bình Mỹ, Huyện Bình Lục, Hà Nam",105.996941,20.493673,Cũ
95,251A25,(ĐNI) An Bình,Đồng Nai,Thành phố Biên Hoà,"Số A1, tổ 8B, hẻm số 71, Đường Vũ Hồng Phô, Phường An Bình, Thành phố Biên Hoà, tỉnh Đồng Nai",106.8654308,10.9302873,Cũ
96,225C04,(HPG) Trại Lẻ,Hải Phòng,Quận Lê Chân,"Số 185 Trại Lẻ, Phường Kênh Dương, Quận Lê Chân, Hải Phòng",106.6892993,20.83007174,Cũ
615,024P01,(HNI)TT.Sóc Sơn,Hà Nội,Huyện Sóc Sơn,"Số 69 Phố Mã, Xã Phù Linh, Huyện Sóc Sơn, Hà Nội",105.853539,21.267775,Cũ
1013,024P02,(HNI)Phú Minh,Hà Nội,Huyện Sóc Sơn,"Số 91, khu 1, xã Phú Minh, Sóc Sơn, Hà Nội",105.830207,21.19826,Cũ
230,024V02,(HNI) Hòa Lạc,Hà Nội,Huyện Thạch Thất,"Thửa đất số 81, tờ bản đồ số 38, thôn Hòa Lạc, xã Bình Yên, Thạch Thất, Hà Nội",105.520943,21.026771,Cũ
902,024V01,(HNI) Thạch Thất,Hà Nội,Huyện Thạch Thất,"26 Đồng Cam, xã kim Quan, Huyện Thạch Thất, Hà Nội",105.577151,21.062198,Cũ
44,024Y02,(HNI) Thanh Oai,Hà Nội,Huyện Thanh Oai,"269, Phố Vác, Canh Hoạch, xã Dân Hòa, Thanh Oai, Hà Nội",105.7695892,20.8497164,Cũ
49,024Y03,(HNI) Bình Minh,Hà Nội,Huyện Thanh Oai,"Số 12, ngã ba đường tỉnh lộ 427, thôn Chợ, xã Bình Minh, huyện Thanh Oai, thành phố Hà Nội",105.763835,20.888052,Cũ
12,024Z04,(HNI) Tân Triều,Hà Nội,Huyện Thanh Trì,"số 68 NV 1 Tổng cục 5 Yên Xá, Xã Tân Triều, Huyện Thanh Trì, Hà Nội",105.7963221,20.9728186,Cũ
13,024Z03,(HNI) Kim Giang,Hà Nội,Huyện Thanh Trì,"Số nhà 738 Kim Giang, xã Thanh Liệt, huyện Thanh Trì, thành phố Hà Nội",105.819328,20.964822,Cũ
276,024H82,(HNI) DC Thanh Trì,Hà Nội,Huyện Thanh Trì,"Đường Đại Áng, Đội 8 Thôn Vĩnh Trung, Xã Đại Áng, Huyện Thanh Trì, Hà Nội",105.831261,20.912116,Cũ
1165,024M05,(HNI)Phan Trọng Tuệ,Hà Nội,Huyện Thanh Trì,"Thửa đất số LK 04-05 khu tái định cư Hữu Hoà, Thanh Trì, Hà Nội",105.8011921,20.95607242,Mở mới
50,024M07,(HNI) Hòa Bình,Hà Nội,Huyện Thường Tín,"Thôn Trát Cầu, Xã Tiền Phong, Huyện Thường Tín, Hà Nội",105.8419166,20.86212993,Cũ
108,299G01,(STG) Côn Đảo,Sóc Trăng,Huyện Mỹ Xuyên,"Khu 6, Đường Võ Thị Sáu, Huyện Côn Đảo, Tỉnh Bà Rịa - Vũng Tàu",106.608224,8.684513,Cũ
109,299D02,(STG) Đại Hải,Sóc Trăng,Huyện Kế Sách,"Ấp Ba Rinh, xã Đại Hải, huyện Kế Sách, Sóc Trăng",105.855743,9.763828,Cũ
110,299F01,(STG) Long Phú,Sóc Trăng,Huyện Long Phú,"Ấp Ngãi Hội 2, Thị Trấn Đại Ngãi, huyện Long phú, tỉnh Sóc Trăng",106.074306,9.73125,Cũ
111,299A02,(STG) Văn Ngọc Chính,Sóc Trăng,Thành phố Sóc Trăng,"Số 499 Đường Tôn Đức Thắng, Khóm 3, Phường 5, Tp. Sóc Trăng, Sóc Trăng",105.986872,9.629644,Cũ
112,299C01,(STG) Thạnh Trị,Sóc Trăng,Huyện Thạnh Trị,"Số 31 Tổ 1 Ấp 2 Quốc Lộ 1A, thị trấn Phú Lộc, huyện Thạnh Trị, tỉnh Sóc Trăng",105.7433,9.428591,Cũ
113,299D01,(STG) Kế Sách,Sóc Trăng,Huyện Kế Sách,"14B Đường Phan Văn Hùng, Ấp An Thành, TT. Kế Sách, Huyện Kế Sách, Sóc Trăng",105.984506,9.765716,Cũ
114,299E01,(STG) Mỹ Xuyên,Sóc Trăng,Huyện Mỹ Xuyên,"Đường lê hồng phong, thị trấn mỹ xuyên, huyện mỹ xuyên, sóc trăng",105.979171,9.570065,Cũ
115,299H01,(STG) Trần Đề,Sóc Trăng,Huyện Trần Đề,"Ấp Giồng Chùa, thị trấn Trần Đề, huyện Trần Đề, Sóc Trăng",106.196605,9.509871,Cũ
116,299I01,(STG) Ngã Năm,Sóc Trăng,Thị xã Ngã Năm,"Khóm 1, Phường 1, Thị xã Ngã Năm, Sóc răng",105.594972,9.561041,Cũ
117,299J01,(STG) Mỹ Tú,Sóc Trăng,Huyện Mỹ Tú,"Quang Trung, ấp Mỹ Thuận, Thị trấn Huỳnh Hữu Nghĩa, Huyện Mỹ Tú, Sóc Trăng",105.807543,9.630283,Cũ
118,299K01,(STG) Cù Lao Dung,Sóc Trăng,Huyện Cù Lao Dung,"Ấp Chợ, thị trấn Cù Lao Dung, huyện Cù Lao Dung, tỉnh Sóc Trăng",106.152149,9.667931,Cũ
119,299L01,(STG) Châu Thành,Sóc Trăng,Huyện Châu Thành(ST),"312, Ấp An Trạch, xã An Hiệp, huyện Châu Thành, tỉnh Sóc Trăng",105.939356,9.650185,Cũ
120,299A01,(STG) TP Sóc Trăng,Sóc Trăng,Thành phố Sóc Trăng,"Số 681, Trần hưng đạo, Khóm 8, Phường 3, Thành phố Sóc Trăng, Sóc Trăng",105.961932,9.582054,Cũ
121,270H01,(VLG) Tam Bình,Vĩnh Long,Huyện Tam Bình,"Ấp Mỹ Phú 1, Xã Tường Lộc, Huyện Tam Bình, Vĩnh Long",105.990387,10.045574,Cũ
122,236B02,(ĐNG) Phạm Hùng,Đà Nẵng,Huyện Hòa Vang,"348 Phạm Hùng, Xã Hoà Phước, Huyện Hoà Vang, TP Đà Nẵng",108.2074714,15.99116979,Cũ
123,297L05,(KGG) Rạch Giá,Kiên Giang,Thành phố Rạch Giá,"Số 45, Nguyễn Bỉnh Khiêm, Phường Vĩnh Thanh,Thành phố Rạch Giá, Kiên Giang",105.088827,10.020437,Cũ
124,297L03,(KGG)Mai Thị Hồng Hạnh,Kiên Giang,Thành phố Rạch Giá,"Lô B4-75 đường 3 Tháng 2, Phường Vĩnh Bảo, Thành phố Rạch Giá, Tỉnh Kiên Giang",105.083694,9.999642,Cũ
125,206B01,(TPC) Quảng Uyên,Cao Bằng,Huyện Quảng Hòa,"Phố Hòa Bình, Thị trấn Quảng Uyên, Huyện Quảng Hòa, Cao Bằng",106.447191,22.686622,Cũ
126,233L01,(QTI) Diên Sanh,Quảng Trị,Huyện Hải Lăng,"82 Trần Phú, Thị trấn Diên Sanh, Huyện Hải Lăng, Quảng Trị",107.2490056,16.6878996,Cũ
127,233G01,(QTI)TT Gio Linh,Quảng Trị,Huyện Gio Linh,178 Lê Duẫn - TT Gio Linh-Huyện Gio Linh-Tỉnh Quảng Trị,107.076311,16.9248,Cũ
128,233F01,(QTI) Hố xá,Quảng Trị,Huyện Vĩnh Linh,72 Lê Duẩn - TT Hố Xá - Vĩnh Linh - Quảng Trị,107.004195,17.067276,Cũ
129,233B01,(QTI)Trần Hưng Đạo,Quảng Trị,Thị xã Quảng Trị,"233 Lê Duẫn, Phường 1, Thị xã Quảng Trịị, Quảng Trị",107.190249,16.74025153,Cũ
130,209A01,(TPB) Phùng Chí Kiên,Bắc Kạn,Thành phố Bắc Kạn,"Tổ 4, Phường Đức Xuân, thành phố Bắc Kạn, Bắc Kạn",105.8395429,22.1498898,Cũ
131,257D03,(PYN) La Hai,Phú Yên,Huyện Đồng Xuân,"Khu Phố Long Thẳng, Thị Trấn La Hai, Huyện Đồng Xuân, Phú Yên",109.099754,13.375737,Cũ
132,257B01,(PYN)Sông Cầu,Phú Yên,Thị xã Sông Cầu,"49 Trần Hưng Đạo, Phường Xuân Phú, Thị xã Sông Cầu, Phú Yên",109.2210545,13.45310074,Cũ
133,258A05,(KHH)Bình Tân,Khánh Hòa,Thành phố Nha Trang,"Số 7 Nguyễn Lộ Trạch,Phường Vĩnh Nguyên, Nha Trang, Khánh Hòa",109.1992605,12.21601764,Cũ
134,292G01,(CTO)Thốt Nốt,Cần Thơ,Quận Thốt Nốt,"Số 88, Khu vực Phụng Thạnh 1, Phường Thốt Nốt, Quận Thốt Nốt, Thành phố Cần Thơ",105.539244,10.265329,Cũ
135,292I01,(CTO) Vĩnh Thạnh,Cần Thơ,Huyện Vĩnh Thạnh(CT),"đường Phù Đổng Thiên Vương, Thị trấn Vĩnh Thạnh, Huyện Vĩnh Thạnh, Cần Thơ",105.3972355,10.22970328,Cũ
136,292E01,(CTO)Ô Môn,Cần Thơ,Quận Ô Môn,"135-137, đường 3/2, Phường Châu Văn Liêm, Quận Ô Môn, Cần Thơ",105.6217604,10.11265952,Cũ
137,292E02,(CTO) Ô Môn 2,Cần Thơ,Quận Ô Môn,"Khu vực Thới Hòa, Phường Long Hưng, Quận Ô Môn, TP Cần Thơ",105.5684388,10.1546322,Cũ
138,292C01,(CTO)Cờ Đỏ,Cần Thơ,Huyện Cờ Đỏ,"Âp Thới Bình, Thị trấn Cờ Đỏ, Huyện Cờ Đỏ, Cần Thơ",105.4347462,10.0882007,Cũ
139,270C01,(VLG) Bình Minh,Vĩnh Long,Thị xã Bình Minh,"Khóm 5, phường Thành Phước, thị xã Bình Minh, Vĩnh Long",105.81012,10.067863,Cũ
140,273F02,(TGG) Hòa Khánh,Tiền Giang,Huyện Cái Bè,"ấp Khu phố, xã Hòa Khánh, huyện Cái Bè, tỉnh Tiền Giang",105.986105,10.361211,Cũ
141,275F01,(BTE) Mỏ Cày Bắc,Bến Tre,Huyện Mỏ Cày Bắc,"Ấp Thanh Bắc , Xã Tân Thanh Tây, Huyện Mỏ Cày Bắc, Bến Tre",106.268302,10.176293,Cũ
142,275G01,(BTE) Chợ Lách,Bến Tre,Huyện Chợ Lách,"Khu phố 1, TT Chợ Lách, H. Chợ Lách, T. Bến Tre",106.121862,10.257022,Cũ
143,294H01,(TVH) Cầu Kè,Trà Vinh,Huyện Cầu Kè,"Đường Lê Văn Tám, khóm 1, thị trấn Cầu Kè, Cầu Kè, Trà Vinh",106.064095,9.869909,Cũ
144,270D02,(VLG) Quốc Lộ 53,Vĩnh Long,Huyện Long Hồ,"190B/11 Ấp Long Thuận A, xã Long Phước, huyện Long Hồ, Vĩnh Long",105.990738,10.225056,Cũ
145,270F01,(VLG) Bình Tân,Vĩnh Long,Huyện Bình Tân,"Tổ 19 khóm Thành Quới, Thị Trấn Tân Quới, huyện Bình Tân, tỉnh Vĩnh Long",105.759937,10.104996,Cũ
146,273F03,(TGG) An Thái Trung,Tiền Giang,Huyện Cái Bè,"Ấp 1, An Thái Trung, Huyện Cái Bè, Tỉnh Tiền Giang",105.890651,10.316779,Cũ
147,294G01,(TVH) Cầu Ngang,Trà Vinh,Huyện Cầu Ngang,"Số 56, Đường 3/2, khóm thống Nhất, Thị Trấn Cầu Ngang, Huyện Cầu Ngang, Trà Vinh",106.45272,9.808409,Cũ
148,294A01,(TVH)Tp.Trà Vinh,Trà Vinh,Thành phố Trà Vinh,"27 Quang Trung, Khóm 5, Phường 4, Thành phố Trà Vinh, Trà Vinh",106.344445,9.942287,Cũ
149,270D01,(VLG) Long Hồ,Vĩnh Long,Huyện Long Hồ,"Ấp Phú Long, Xã Phú Quới, huyện Long Hồ, Vĩnh Long",105.924763,10.160989,Cũ
150,294A02,(TVH) Nguyễn Thị Minh Khai,Trà Vinh,Thành phố Trà Vinh,"Khóm 8, phường 7, TP. Trà Vinh, tỉnh Trà Vinh",106.329643,9.934658,Cũ
151,294B01,(TVH)Duyên Hải,Trà Vinh,Thị xã Duyên Hải,"Khóm 2 Phường 1, thị xã Duyên Hải, tỉnh Trà Vinh",106.491933,9.634407,Cũ
152,294C01,(TVH)Tiểu Cần,Trà Vinh,Huyện Tiểu Cần,"Khóm 1, thị trấn Tiểu Cần, huyện Tiểu Cần, tỉnh Trà Vinh",106.188203,9.811867,Cũ
